{
  "schema_version": "2.0",
  "validation_id": "post-write-release-fixture-001",
  "plugin_version": "1.2.2",
  "workflow_run_id": "release-fixture-run-001",
  "checked_at": "2026-07-10T01:08:01Z",
  "final_validator_verdict": "pass",
  "unsupported_final_claims": [],
  "citation_or_provenance_mismatches": [],
  "missing_uncertainty_or_limitations": [],
  "safety_ethics_privacy_issues": [],
  "failure_mode_checklist": [
    {
      "failure_mode": "FM10 reviewer/writer self-ratification",
      "status": "pass",
      "reason": "The accepted wording is bound to a successful external-tool runtime receipt and output hash."
    }
  ],
  "excluded_claim_handling": "No excluded claims are rendered.",
  "independent_review_status": "Hash-bound external-tool review REVIEW-EXT-001 completed successfully.",
  "minimal_required_corrections": [],
  "release_ready_claim_strength": "high-confidence within the bounded synthetic validator scenario",
  "reviewed_final_ref": "final.md",
  "reviewed_final_sha256": "8eb055362c38eab00bbdec5dc0457a88bc7a47c8c95ee3d5d340a9a0fa3566fe",
  "reviewed_ledger_ref": "claim_ledger.json",
  "reviewed_ledger_sha256": "0ab4a0c1e355d981eda25af4abcd326234ac32503c61aa8e02ca8c6fede51742",
  "coverage_review_instance_id": "REVIEW-EXT-001",
  "wording_policy": "literal",
  "content_coverage": [
    {
      "block_id": "B0001",
      "block_sha256": "cf35b2612dd4752a645f234407ff7ec9ace5259b3639ed9e6574782696884143",
      "classification": "non-claim",
      "claim_ids": [],
      "reason": "Synthetic fixture: report framing and process label"
    },
    {
      "block_id": "B0002",
      "block_sha256": "1d37609084653a3fe3fd1c9d420854a6cd694743960a3179a93d390281642ae4",
      "classification": "claim",
      "claim_ids": [
        "CL-001"
      ],
      "reason": ""
    },
    {
      "block_id": "B0003",
      "block_sha256": "81ef315fbe4bf8a3966d589d580a32f6ac8e4d36427a8830b6d980a805f7e935",
      "classification": "non-claim",
      "claim_ids": [],
      "reason": "Synthetic fixture: report framing and process label"
    }
  ]
}
